{
  "assignment": "assignment3",
  "title": "Group Chain of Contracts",
  "network": "sepolia",
  "group": {
    "group_id": "G1",
    "members": [
      {
        "student_id": "001",
        "name": "Student A",
        "wallet": "0x1111111111111111111111111111111111111111",
        "role": "ChainEntry",
        "owned_contract": "0x2222222222222222222222222222222222222222",
        "deployment_tx": "0xaaaaaaaaaaaaaaaaaaaaaaaaaaaaaaaaaaaaaaaaaaaaaaaaaaaaaaaaaaaaaaaa"
      },
      {
        "student_id": "002",
        "name": "Student B",
        "wallet": "0x3333333333333333333333333333333333333333",
        "role": "ChainLink1",
        "owned_contract": "0x4444444444444444444444444444444444444444",
        "deployment_tx": "0xbbbbbbbbbbbbbbbbbbbbbbbbbbbbbbbbbbbbbbbbbbbbbbbbbbbbbbbbbbbbbbbb"
      },
      {
        "student_id": "003",
        "name": "Student C",
        "wallet": "0x5555555555555555555555555555555555555555",
        "role": "ChainLink2",
        "owned_contract": "0x6666666666666666666666666666666666666666",
        "deployment_tx": "0xcccccccccccccccccccccccccccccccccccccccccccccccccccccccccccccccc"
      }
    ]
  },
  "chain": {
    "chain_entry": "0x2222222222222222222222222222222222222222",
    "chain_links": [
      "0x4444444444444444444444444444444444444444",
      "0x6666666666666666666666666666666666666666",
      "0x8888888888888888888888888888888888888888"
    ],
    "chain_terminal": "0x9999999999999999999999999999999999999999",
    "connection_txs": [
      "0xffffffffffffffffffffffffffffffffffffffffffffffffffffffffffffffff"
    ],
    "start_chain_tx": "0x6666666666666666666666666666666666666666666666666666666666666666",
    "explorer_url": "https://sepolia.etherscan.io/tx/0x6666666666666666666666666666666666666666666666666666666666666666",
    "input_data": "0x1234",
    "expected_event_order": [
      "ChainStarted",
      "EntryExecuted",
      "LinkExecuted",
      "LinkExecuted",
      "LinkExecuted",
      "FinalReceived",
      "ChainCompleted"
    ],
    "final_result": "0x1234"
  },
  "report": {
    "repository_url": "https://github.com/example-group/assignment3-chain-of-contracts",
    "report_path": "reports/assignment3-report.md",
    "notes": "Example only. Replace with real addresses and transactions."
  }
}
